score,text
1,윤여정 특유의 애잔하고 슬픈연기가 돋보였고갈등 요소가 잘드러나는 스토리였다.
0,와 진짜 살면서 이런 영화는 첨 보네요...
0,재미없었어요 너무 기대가 컸나봐요기대감 완전히 내려놓고 나는 시간 많다 하시는분들만 보세요
0,감동과 공감 요소를 억지로 끼워넣은 것 같았다.
1,"물과 미나리, 그 메타포가 좋다"
1,"성장영화입니다. 깊은곳에서 오는 감정이 있었어요.미나리 많이 넣은신선한 회무침이 생각나요저 뭔소리하는거죠ㅋㅋㄱ영상미, 음악 다 좋아요"
1,어떤 역사영화보다 감동적
1,하....  이것이 제 심사평입니다. 이런 게 바로 영화 아니겠습니다. 오늘 하루 하.. 할듯..
0,가족들과 같이 봤는데 다들 졸았음ㅜㅠ
1,마음 따뜻한 영화입니다자극적인 영화만보다가~~~편하하게 관람 강추~~~
1,윤여정 배우의 연기력이 돋보인 영화
0,국내에서 흥행하긴 힘들겠음 외국인 관점에서는 가능 도무지 감동 재미가 없어ㅠ
0,"일단, 무엇보다 재미가 너무없고 지루하다     상받을만한가?"
1,결말 제외 하곤 다 좋아요. (걸말이 '어벤져스: 인피니티 워' 때랑 느낌이 비슷했음)
1,그냥 눈물이 주륵주륵 났음
1,미나리와 할머니로 모든것이 설명되었던 영화. 이보다 잔잔하면서 담백할 수 없다
1,오랜 만에 집중 할 수있고 연기자들의연기력에 박수 보냅니다. 감사합니다
1,가족이 뭔지 알게 해주는 영화다. 이민자들의 힘들고 아픈 역경을 딛고 일어나는 그런 아름다운 영화 그리고 음악
1,"데이빗이 제이콥과 함께 찾아간 미나리 숲, 아름다운 장면이 생생하다.순자의 웃음과 여유는 동양적인 삶의 지혜에서 나온 것이어서반가웠다."
1,"잔잔한 연출안에 숨겨져있는 거대한 연출, 풍부한 연기와 스토리어느하나 빠질게 없는 영화였다 보고난 후 마음이 웅장해졌다"
1,영화 보세요 평점 보지말고
1,잔잔하게 끝까지 걸어보는 영화
1,연기를 다들 너무잘하고 살아가려고하는 모습들이 짠하고 아이부터 할머니까지 전세대의 삶의모습이 지금도 비슷하네요 그때나 지금이나 인생은 비슷하구나 .그때가 흑백이라면 지금은 색깔이 화려해졌을뿐.
1,틈틈히 눈물이 났던 자극적인게 익숙해진 현대인들에게 미나리 내음을 느끼게 해준 그런 영화
1,"정말 여러 영화를 봤지만, 너무 잔잔하면서도 애잖하고, 따뜻한 영화였습니다.감사합니다, 이런 멋진 영화를 만들어주셔서."
1,잔잔하지만 시간가는줄모르고 봤어요
1,잔잔해서 보는동안은 답답하기도 했는데 마지막 불부터 데이빗 뛰는장면 그리고 미나리밭까지 뭔가 끝이 아니라 시작되는 것 같았다. 그리고 이 영화는 다보고 나서 계속 생각나고 뒤늦게 감동이 느껴진다.
1,좋아요
1,"미나리같은 삶을 사는 사람들..울리지도 않고 웃기지도 않습니다. 그시절 이민자들을 관조합니다...연속되는 커다란 불행, 그 사이에 빼꼼히 내미는 작은 희망 혹은 행복. 현실은 더하지 않았을까 조심스래 생각해봅니다."
0,윤여정의 연기야 원래 잘해왔으니까 그러나 영화는 평범하기만 하다.스티브 연의 연기...이남자의 어색한 연기의 거품도 이젠 말해야한다 가장 과대평가된 배우중 하나.아카데미 후보지명도 작품덕일뿐.
1,"지금 우리 부부, 가족 상황이랑 비슷해서., 내겐 위로며 응원가가 되어주었음. 어디서든 뿌리를 내리고 살아가기가 이렇게 쉬운일이 아니라는거..."
1,어린 시절 타버렸던 우리 아빠의 공장이 떠올랐어요그때 아빠도 그런 심정이었을까 그날 처음이자 마지막으로 아빠의 눈물을 봤었는데정말 50원부터 시작해서 자수성가로 지금은 꽤나 건장한 회사를 잘 지켜줘서... 너무 고마...
1,잔잔한 스토리에 감동까지 그안에서 할머니의 사랑과 가족갈등을 잘 그려낸거같아요 잘봤어요
1,공감 그리고 여운이 최고였던 명작
1,본영화 제작자 브래드피트 주연의 가을의전설처럼 플롯이 화려하진 않지만 조미료 쏙뺀 담백한 구성과 목가적인 영상미가 마음을 평온하게 그리고 아련하게 흔들었다. 두 영화 모두 가족애에 대한 영화로는 기억에 길이 남을듯
1,재미있어요 추천합니다
1,"영화를 보고 나서 시간이 지날수록 새록새록 여운이 생겨나는 영화입니다. 이민세대의 힘겨움, 미국 시골 백인과의 관계, 교민사회에서의 교회 등등 잘 표현했고 할머니, 이민 가정의 가장. 어려움 속에 미나리처럼 계속 살..."
1,평범하면서도 그 시대 이민인의 실생활을 알수있어서 흥미로웠습니다.
1,잔잔하게  잘만든 영화입니다
1,개인적으로 사료(史料)로써의 가치가 충분한 영화라 생각합니다. 아카데미 수상여부와 상관없이. 깊은 울림이 있는 영화입니다
1,좋았습니다 연기도 연출도~
1,잔잔한 우리들의이야기
1,한예리 윤여정 연기 대박
1,초반부 에는 좀뭔가 지루하며 늘어지는거 같았지만 계속 보다보니 실제있을법한 상황에 70~80년대의 그시절 생각도 나고 마지막 여훈도 남는 영화 입니다. 여기 평점보니 한국인들은 영화가 꼭 배우들이 오바연기 에 신파가...
1,마지막 윤여정 배우님의 눈빛이 잊혀지지않네요
1,남루한 삶 그 순간들  그리고 또 살아내야하는 이유..좋은 영화예요.
1,보는 내내 짠하고 마음 조리며 봤음. 스토리는 잔잔한데 어찌나 걱정이 되던지...결국 울었네유
1,"잔잔한 영상미, 과하지 않고 효과적인 OST, 윤여정님의 관록이 묻어나는 명품 연기"
1,모험가와 개척자의 뒤에는 묵묵히 그들을 지지해주는 가족  또는 누군가가 반드시 있다는 사실과  지금의 평안한 삶이 결코 누군가의 희생없이는 이루어질수 있는게 아니라는 사실이 영화에 녹여 있다.
1,2000년대 초반 우리 온가족이 미국에 유학갔을때가 떠오르면서 공감도 많이되는 영화였습니다.
1,미나리가 심장에 좋다고 들었어요 잘은 모르겠지만.. 아무것도 없는 땅에서 그나마 노력으로 일군 모든것이 할머니때문에 사라진것 같아보였겠지만 결국엔 할머니의 미나리로 가장 어려웠을 시기를 잘 견뎌냈을것 같아요 또 손자...
1,치밀한 기억의 소환. 우리 외할머니가 생각난다.
1,엄청 미묘하다. 이상과 현실 복잡함을 다룬 되게 독특했다. 겉음 정말 아름다운데 그럴 수 없는 현실
1,"와 진짜...우리 현대사회에서 우리가 느껴야 될 의미를 영화속에 잘 풀어낸거 같음..미나리는 씨앗만 땅에 뿌리면 아무데서나 잘 자라는 것처럼 미국=땅,제이콥가족=미나리 씨앗 그 당시 미국으로 이주한 한국인들의 정서를..."
1,이민자들의 삶을 보니 많은 어려움 속에서도 견디며 많은 이민자들의 삶을 끌어올린 개척자들의 모습이 마음이 아프면서도 감동이었어요 미나리를 통해서 국위를 선양했네요 감사하네요
1,아주 잘봤습니다! 상받는영화란 이런 영화군요
1,드디어 이 영화 봤습니다.  하도 떠들어서 실망할 것을 각오했는데 가슴 먹먹해지도록 먹을 것 참 많은 소문난 잔치더군요.
1,이민 사회의 한국인들을 미나리에 잘 빗대어 좋은 음악과 함께 잘 표현 했다. 희망적이다.윤여정의 연기는 한국에서 늘 봐오던 그대로의 연기이지만 세계인들은 그 연기를 처음 봤으니 놀랄수밖에.
1,솔직히 예술영화 특성상 확실하게 맺고 끊는게 없어서 상업영화에 익숙한 나로선 찜찜한 결말이었지만.. 평점 8점대라니... 이런 대접받을 영화는 아니다 연출과 연기.. 시대상과 환경을 영화로서 너무 잘 풀어냈다
1,폭풍처럼 잔잔한... 한국판 로마
1,보면서 계속 부모님이 생각나는 영화..
1,잔잔한 이민가족의 모습....
1,어쩌면 나의 이야기가 될 수도 있다는 생각이 들었다. 생각이 많아지는 영화
1,오히려 대단한 내용이 없어서 더 좋았습니다.80년대 아메리칸 드림을 꿈꾸며 미국에서 어렵사리 정착해나가는 어느 평범한 한인 가족의 삶을 꾸밈없이 사실적으로 본 거 같습니다. 글쎄요.. 다들 재미 없었다고 하고 스토리...
1,"현실적인, 마치 이웃의 모습을 영상을 담아 보는 기분을 느낀 영화 편하고 잔잔하고 촌밭의 쉼같은 영화"
1,제겐 아름다운 영화였어요. 코로나로 팍팍한 세상 가운데 잔잔한 감동과 위로를 받았어요. 영상을 보는 것 만으로도 쉼을 얻었네요. 숲을 보며 일광욕 하는 기분이랄까. 7살9살 딸들도 좋아하는 포인트들이 있어서 함께 잘...
1,"원더풀 미나리, 원더풀!!"
1,평범한 아메리칸 드림 과정을 서정적이면서도 약간의 괴기스러운 감정을 느끼게하는 조연들 연기들로 영화적인 요소를 놓치지않는 전혀 지루하지않는 명품영화네요! 실제 미나리를 좋아하시는 저희 어머니도 너무 재미있게  보셨다...
1,윤여정 배우님 오스카상 진심으로 축하드립니다 재미있게 봤어요
1,그냥 최고 그 자체. 여윤이 오래도록
1,"별로라는 평보고 기대안했다가, 잔잔하게 물흐르듯 빨려 들어가 펑펑 울다 끝났네요. 저는 너무 좋았습니다. 왜 꼭 엄청난 반전이나 스토리를 기대해야할까요. 우리인생이 그렇게 스펙타클하지 않는데 말이죠. 나이를 먹고 봐..."
1,미국이든 한국이든 어디가 중요한게 아닌 그냥 우리네 일상이야기.다른 누구보다 데이빗이 최고
1,재미 혹은 지루함 두 가지 요소로만 평가하기엔 꽤나 퀄리티 높았던 영화라고 생각합니다
1,왠지 모르게 보는 내내 마음이 찡해지는 영화였습니다. 어딘가 웅장한 음악도 광활한 미국의 낯선땅이 어떤 의미였을지 생각해보게 합니다. 스펙타클하지 않아도 스티븐연의 마지막 대사에서 감독님의 이민자들의 삶을 응원하는 ...
1,오랜만에 가슴이 찡하고 여운이 남는 영화입니다. 감정을 폭발시키기보다 눌러담은 듯한 잔잔함과 담백하지만 마음을 툭툭 한번씩 건드려주는 대사들이  너무 좋았습니다. 미나리 엔딩도 슬며시 미소가 지어지네요.
1,이 영화의 존재와 행보 전체가 경이로운 아이러니 가득
1,처음 봤을때 보다 2번째가 더 좋았어요.윌 패튼의 연기도 넘 좋았어요
1,잔잔한 호수위에 백조와 그 수면밑에서 처절하게 발버둥치는 물 속 물갈퀴의 양면을 보는 듯한 묵직한  여운을 남기는 영화 .
1,영상미와 함께 뭔가 잔잔하면서 충분히 멋진 영화입니다.
1,윤여정 최고다 최고!!!!
1,윤여정 배우님 축하드립니다! 한국은 윤여정 보유국이다!!!
1,윤여정님 아카데미 여우조연상 축하드립니다수상소감 역시 넘 좋았어요 길어도 지루하지 않은..70대에도 멋질수가 있구나..
1,"아직 결혼을 안 해서 그런지 데이빗의 시선으로 영화를 보게 되네요 할머니는 할머니고 아빠는 아빠, 엄마는 엄마더라기대하시는 큰 감동은 없을 수도 있겠지만 보는 내내 눈물이 나네요"
1,영상미가돋보이고 잔잔하지만감동적이었습니다
1,마음이 짠하면서 답답하지 않고 편안했다. 좋은 영화..
1,내 노년의 롤모델인 윤여정님!  오늘 아침 아카데미 방송한다고해서 급히 챙겨봤네요. 꼭 수상하시길 바래봅니다.
1,진짜 좋아요 배우분들 연기 짱
1,그냥 보는 내내 눈물이 났다.
1,좋은 작품인 것 같아요. 너무 공감이 가는 영화였습니다.
1,가족의 사랑을 과장되지 않게 표현했지만 무엇보다 아름답게 느껴졌습니다.
1,드디어 시리즈온에 풀려서 엄마랑 둘이서 보는데 정말 재밌게 봄.잔잔한 가족 영화라고 해서 슬플 거라 생각했었는데 웃음포인트가 의외로 많아서 둘이서 엄청 웃음ㅋㅋㅋ웃긴 부분도 그렇고 힘든 부분도 그렇고 어릴 때 생각을...
1,잔잔~~감동을 주는 영화로 .. 하하하
1,평범한 내용이지만 연출과 연기로 빛난영화. 2시간이 행복했다..
1,윤여정은  어머니같다..  자연스러운 연기는   소리없이 흐르는 냇물같다
1,너무 먹먹하고 슬퍼요 ㅠㅠ 속상한 마음에 감정 이입이 너무 되어서 그런지
1,알 수 없는 눈물과 먹먹함이 엔딩크레딧 올라감에 따라 나를 가득 채워왔다. 정말 좋은 영화 한 편 덕분에 힐링 제대로!
1,"아름다운 영화 영상미. 코믹 ,시대적 추억 ~ 오랜만에 힐링 좋은영화 10점이상.. 잘보앗습니다~~"
1,내 감성을 적시는 잔잔한 영화
1,아메리칸 드림. 그리고 모두의 꿈.
1,잔잔하니 보기 좋고 급전개방식이 아니고 천천히 흘러가는 느낌이라 보면서 편했어요
1,마지막에 울어버렸네요. 왜 윤여정인지 알겠습니다.
1,잔잔하게 깊은 여운이 남는영화
1,"내 인생이랑 묘하게 겹쳐 보여서 그런가, 계속 눈물이 흘렀다. 배우들 연기도 더할 나위 없이 좋았던 게, 교포 아이들이 또박또박 서투른 한국어, 특히 존댓말로 부모님께 말하는 거랑 어른들이 영어 섞어 말하는 것 등등..."
1,"부부의 소통, 가치관의 차이, 생계의 문제, 좌절부부의 소통, 가치관의 차이, 생계의 문제, 좌절이 인상적이었다."
1,좋았습니다  ~~  딩동 브로큰
1,악평도 많은데 갑자기 끝난 느낌은 있지만 뭐 이 정도면 괜찮은 영화
1,오만가지 삶과 감정이 농축된 영화
1,영상미와 OST가 좋았어요
1,"비오는데 잔잔한 영화, 너무 잘 봤습니다!!"
1,음악 영상미 연기 좋았어요
1,재밌었어요. 다들 이기적인 것 같아 답답하면서도 한편으로는 각자의 마음이 이해가 되어 묘했습니다. 결국 제이콥이 우여곡절하며 겨우 이뤄낸 농작물은 한번에 다 타버렸지만 순자가 대충 아무렇게나 심은 미나리는 보란듯이 ...
1,언젠가 다시 생각날 것 같은 영화.
1,감동적인 영화에요. 강추합니다.
1,잔잔하지만 가족과 그들의 사랑에대한깊은 통찰과 섬세한 표현들이 스며있는 따듯하고 아름다운 영화!
1,멀리보고 살자 고난이 연속으로 와도기회는 꼭 찾아온다
1,"엄마와 함께 봤어요. 조금 루즈한듯하나 할머니 할아버지 생각도 많이나고,,,전체적인 느낌이 힐링이라 잔잔하게 여운이 남네요.자극적인 요소가 전혀 없어서 좋았어요.발음이나 음성전달이 조금 아쉬운 부분은 있네요."
1,"잔잔하지만 지루하지 않은, 드라마틱한 엔딩이 아니라서 더 아름다웠다"
0,그냥 평타. 재미는 없음. 나중에 명절특선으로 공중파 해주면 보세요.
1,2번이상 보는거 추천드려요.  놓친 장면 다시 보이고..감동 포인트도 틀리네요...이런 느낌 주는 영화 오랜만입니다. 보고나서..잔상이 오래갑니다.. 스토리로 보는 영화가 아닙니다..
1,정말 기대 이상이었습니다. 간만에 엄청난 수작이 나왔네요!
1,누군가의 인생이 영화 한편으로 모두 이해가 되었습니다.
1,재밌습니다 미나리추천입니다
1,아름다운 소설을 보는 것 같은 영화
1,"남자라서? 가장으로서? 무언가 하날 꼭 보여줘야하나? 부담감일까? 오히려 희생의 자세는 왜 못했을까? 등등 고정관념이 약간은 섞여있다고도 생각이 든다. 하지만 문학소설을 읽는듯한 느낌을 받는 연출, 발음 하나하나 섬..."
1,부모님  보여드렸는데 슬프다고 하시네요간만에 가족영화 나온것 같아 보여드렸는데슬프다고하시니  다음에는    즐거운 영화 부탁드려요
1,"잔잔하지만, 마음으로 다가오는 영화네요. 미나리와 연결된 모두에게 찬사를 보냅니다~~"
1,극장문을 나서면서 마농의 샘이 떠올랐다. 생명체는 생존본능과 종족보존 본능이 동시에 있다. 남녀가 이해하고 구현하는 방식은 다르다. 암컷은 희생으로 숫컷은 도전으로 이해한다. 같은 목표를 갖고있지만 접근방식이 달라 ...
1,저희 부모님 생각이 많이났습니다. 자식들 먹이고 성공시키겠다고 자신들을 희생하시는 모습들.. 어릴때 왜저러시나 했는데 이제야 이해가는 그 모습들. 부모님과 저희 친척들이 많이 생각나는 영화입니다. 한국인들은 다시 일...
1,가슴 따뜻해지는 영화입니다.
1,우리 할머니 같지 않았지만 너무 익숙한 우리 할머니였다.
1,절제된 연출이 좋네요. 배우들은 안 울고 저만 웁니다.
1,기대를 져버리지 않았음간만에 보는 수작
1,할머니 보고싶다.. 미나리 미나리 원더풀 원더풀
1,아니 님들아 지루하네 어쩌네 하지좀말고 영화의 영상미 촬영 기법 음악에 초첨을 맞춰.. 영화는 시각적 영상 예술임 그냥 즐거움을 주는 것보다 잔잔하고 포근한 그 느낌을 보세요 그시대를 잘 느낄수있고 마지막 엔딩은 띠...
1,"햇빛에 일광욕 잔뜩 한 것 같이 개운한 감동을 주는 영화- 바쁘실 때 보면 안되고 느긋한 휴일에 간식과 함께 편안히 보다보면 영상과 음향, 대사, 연기, 그리고 가족의 의미를 온전히 느낄 수 있는 영화."
1,가족을 생각하면서도 다른점의 교훈을 얻을 수있었다.
1,처음으로 이런 평점을 남겨보네요. 아마도 한국 사람들에게는 어색하고 뭔가 심심하고 결말에 대한 아쉬운 부분이 있을수도 있지 않을까 생각했는데.. 영화 시작 부터 끝까지 저에게는 계속해서 잔잔한 감동이 더해졌고 감독님...
1,나는 잔잔하다는걸 이해할 수 없었다..너무 전쟁같은 영화였다.. 감정에 너무 몰입해서 절정에서는 가만히 앉아있기가 불편할정도였다.
1,"한예리 배우의 극중 시대상황을 녹여낸 캐릭성에 크게 감탄했습니다. 윤여정 배우님의 연기는 항상 가슴 먹먹한 느낌을 얻게 되는데요, 미나리 보다 연기로써 더 감동을 받았던 작품은 계춘할망인 것 같습니다."
1,다 완벽한 영화!!! 정말 연기 연출 오에스티 전부 완벽했어요
1,보는내내 왜 눈물이 자꾸 날까요? 아무도 없는 땅에서 아빠의 의지와 용기가 대단하고 함께하는 아내도 대단하고 아무도 없는곳에서 가족들의 끈끈이 모여 함께하는모습에서 감명깊게 봤습니다. 할머니께서 뇌졸증걸리고 불나고 ...
1,"단순한 스토리, 악의없는 착한영화, 가족의 참...질기고도 질긴 끈을 표현한 영화. 끝날땐 기대만큼은 별론거 아냐? 싶은생각1초 이후 먹먹하고 계속 장면들이 떠오르는...잘 만들었소!!"
1,모성에 대한 그리움. 국경으로만 이방인이 구분되어지지 않듯... 어느 자리에서든 외롭게 싸우고 있는 사람들에게 할머니는 그리고 싶은 존재일 겁니다.이방인으로서 담담하게 살아가는 모든 힘든 사람들에게 울림을 주는 영화...
1,별 기대없이 봤는데 너무 좋았다. 복선도 없고 너무 단순하고 세계관이 좁은 한국영화들과 결이 달랐다. 도입음악부터 뭔가 이 영화가 다름을 시사해주었다. 뭘 말하려고 하는지 모른다거나 끝이 허무하다는 사람들 이해가 안...
1,조미료에 익숙해진 내 입에 재료 본연의 잔잔한 맛을 느끼게 해 준다.
1,더 있다간 영화를  극장에서 못볼거 같아서 예매하고 봤는데 조퇴하고 본 보람이 있네요. 엄마와 딸이 함께 보면 더 좋을거 같아요. 안보이는게 더 위험하다는 윤여정 할머니의 얘기가 여운이 남네요. 배경은 미국이지만 충...
0,평론가와 허세충들이 좋아할 영화
1,"스토리가 극적인 요소가 없어 심심하다고 생각할수 있겠지만, 사실 삶은 기승전결로 이루어진 교향악이 아니라 희비극의 변증법적 무조음악 같은 것이다. 그래서 영화가 지극히 현실적이고 보편적으로 다가온다."
1,코로나이후로 처음으로 영화관에 갔어요 너무너무 보고싶었거든요ㅋㅋ 마운틴듀를 보고 산에서 내려온이슬이라는데 극장에서 저혼자만 웃어서 민망했어요ㅎ;;미국사람들은 여러번웃었을것같아요ㅋㅋ전체적으로 잔잔하면서 가족에 대한 생...
0,그냥 잔잔하게 볼 수 있는 영화라고 생각해요. 저는 현실적인걸 많이 본것같아요
0,1. 스티븐 연 아직 한국어 연기 무리인 듯. 누가 봐도 미국서 나고 자란 사람.2. 감독의 지나치게 개인적이고 자전적인 이야기. 공감이 어렵다.3. 이런 영화가 새롭나...? 한국계 얘긴 처음일지 몰라도 이런 이민...
1,장난아니다 개봉작중 쵝오다!!!! 모든 합이 다 좋았다
0,"감독의 역량부족 때문인지 뭔가 많이 부족했다 영화에서 언급하지 않고 생략한 부분이 많아서 인지, 편집의 문제인지는 모르겠지만 영화에 훅빠져드는게 아니라, 응?? 저건 무슨 의미지? 왜 저러지? 저 아저씨는 뭐지? 등..."
0,음 what 뭐지?나만 이해력이 떨어지나?
1,어느것하나과장되지않은잔잔하면서도감동적인영화~~오스카상수상응원합니당~~♡
1,할머니 생각나서 펑펑 울었다
1,개인의 경험과 환경에 따라 느낌은 다르겠지만 차분하면서 과거 현재 미래를 바라보게 한다.
1,배우들이 다 연기를 잘 했어요. 잘 봤습니다
1,너무 감동적인 좋은 영화입니다~~~
0,"출연자들 연기는 뛰어난데.... 갑자기 영화가 끝나서 당황했다.  내가 아는 영화 문법으로는 좀더 이야기가 진행되어야하는데 끝나서는 안될 상태에서 갑자기 ""미나리는 아무데서나 잘 자라네"" 이러면서 끝난..."
0,아메리칸 드림 꿈꾸는 이민자
1,이 영화 안보면 인생의 절반은 후회한다.
0,자다보다자다보다자다보다? 윤여정씨가 실수로 낸 불로 창고를 다 태워 강가에 심어 놓은 미나리가 판로물로 전환 되나 싶었는데 미나리 뜯으며 끝? 우린 아직 감동도 못 받았는데 이럴수가. 그리고 미국에 가서 누구나 생존...
0,아이들 연기을 더 잘하는거 갖더라
0,역시 평론가들은 전임 평론가들을 따라가는구나.... 소수의견은 없네.. 내가 이상한 건가...
0,너무너무 잔잔한 영화  아무 생각이 없어진다
0,뭘 전달하고자 하는건지 모르겠다갈등구조는 너무 평범하고뻔하디뻔한 이야기들에진짜 고생일 미국한인사회 내 갈등이나 동양임 차별 등의 내용은 한마디로 퉁치거나 없다.작중에 전 땅 주인은 감당하지 못할 실패에 자살하고한국인...
0,"기대 이하, 스토리가 힘이 없어요.윤여정, 한예리 배우의 연기력으로만 끌고간 영화"
0,"클로즈업샷, 감동적인 음악, 진부한 스토리이 영화에 상준 건 인종 역차별인듯"
0,정말 재미없음 ㆍㆍ 잠오기좋은 영화
0,미국영화를 가지고 국뽕마케팅하는 꼴이라니
0,그냥 감동도 없고 시종일관 잔잔한 영화임.
0,국뽕 좀 그만 합시다.  짱깨도 아니고.   걍 그래요.  ㅎㅎ
0,보고 자다가 허무하게 끝났다. 뭐 하나라도 결말을 지어주길 원했음
0,다 잡으려다 아무것도 잡지 못한영화.
1,아이들과 부담없이 볼수있는 가족 영화입니다
0,감동도 재미도 없음. 킬링타임으로도 의미 없는 영화. 최악이다ㅋㅋ
0,한번도 경험 해보지 못한 영화. 왜 상받았는지 알겠더라. 너무 어이가 없어서 참신함
0,무슨 메세지를 주려했는지 알겠는데... !!  그냥 영화 봤다는 느낌 보다는 잔잔하고 재미없는 소설책 본듯하다. 가족들이 따뜻한 느낌이 없었다. (물론 감독 의도 일수도 있지만.. )
0,롯데아라점서 방금보고왔네요.솔까 이게 왜 상을 휩쓴지 잘모르겠다.
0,무슨 내용의 느낌인지 참..
0,난해한건지 짜임새가 없는건지 전 별로 였습니다
0,호불호가 있을 거 같아요
0,덕분에 이 나라에서 뜨고 싶은 생각이 더 커졌습니다. 연기는 좋았는데 개인적으로는 가족영화 볼때마다 짜증만나네요
0,개노잼 너무 재미없어서 괜히 화장실만 서너번 갔다옴 아...ㅋ
0,심하게 재미없네요 보는내내 화만나고...  기생충이나 미나리나 정말 이런계의 한국을 대표하는 영화인거죠? 안보고 말지...
0,영상미나 음악은 참 좋은데 교회 비판이 영화에 갑자기 왜 나오는건가요.. 전개상 의미도 없고 좀 거북했어요
