score,text
1,꼭 보세요 원래 영화보면 잠오는데 이건 집중해서 끝까지 봤음 여러번 볼 수 있을 정도 분노의 질주는 제 인생영화에요
1,배우들 연기력 짱짱이고 액션 스토리 탄탄입니다!
1,스릴감 긴장감 액션 유머 연기 다 완벽하다
1,걍 딱 즐기기 좋은 액션영화였다는ㅎㅎ
1,노래까지 좋아버리면 어쩔~!믿.보.분노시리즈!
1,재밌게 잘 만든 영화네요ㅎㅎㅎ
1,넘 재밋어요.. 분질 사랑해요..
1,질주 본능. 아주 박진감 넘칩니다.
1,제목 한번 진짜 잘 지었다ㅋㅋㅋ
1,스트레스 해소에는 액션이 딱이지
1,"킬링타임용 영화로 추천, 영화관 가서 보기에 나쁘지 않음"
1,액션 지리고~ 유머도~~굿!!
1,가족의 의미를 깨닫게 되는 좋은 영화였다.
1,캐릭터 다 볼매야 입덕각ㅠㅠㅠ
1,분노의 질주는 이번에 처음 봤는데스케일부터 스타일까지 완전 내 맘에 쏙~~
1,어마어마해요 최고예여 진짜아ㅏ 또볼거야!!!!
1,들어가자마자 돔 형님에게 제대로 감겼다 ㅋㅋ
1,아무것도 몰라서 걱정했는데 액션이 다한 영화라 시원 짜릿하게 보고 왔음!
1,너무 재밌고 소재도 신박하네요
1,늘 그렇듯 속 시원합니다 :)
1,모든 자동차들이 포카칩처럼 바사삭 부서지는맛
1,정말 유니버스하다 하하하
1,역시 분노의질주 ㅋㅋ너무잼잇게봣어요!!!
1,코로나로 영화관 전세내고 봄 미쳤다
1,명불허전입니다  넘 즐거워요
1,역시 이제  다 알잖아 그래도 볼만함
1,"물리 법칙, 개연성, 감정선 따위 개나 줘버리고 그냥 때려부숨. 그래서 너무 좋음."
1,마지막에 스카이라인 r34 폴 당신이 그립습니다
1,스토리는 상관없다 ㅋ인도영화를 헐리웃에서 찍으면 이렇게 된다 어벤져스 보는 줄 ㅋㅋ보면 시원함. 분노의 질주는 이맛이얌 ㅋ
1,한자리가 빈 엔딩을위해 이영화가 나온것같다
1,한이 왜 거기서나와~쿠키도있는데 담편도 기대되개 만드는!
1,마지막이 하이라이트지유
1,시간가는지도 몰랐고 일단 몇장면에서 웃김
1,심장이팡팡 마음이몽글몽글 스트레스팍팍날려주는 분노시리즈 한번더보고시픔 ㅜ
1,역시....믿고보는 분노위질주
1,카디비 무슨일이냐고 진짜 ㅋㅋㅋ믿고보는 분노의질주 유쾌하고 스릴넘치고 화려하고 통쾌했음 ㅎㅎ
1,보통 시리즈는 1이 제일 재밌는데 9가최고!!ㅎㅎ8을 능가할줄이야
1,너무너무 재밌어요♡!! 역시 분노의 질주 최고♡
1,킬링타임 아주재밌습니다~~~
1,너무 재밌었습니다 이런 액션은 솔직히 분노의 질주에서 밖에 못보는 특급 액션신들과 청펑 터지는 차들 너무 눈이 즐거웠고 중간중간에 사랑 가족 의리 등과 같은 감성적인 면도 좋았고 나라별로 휙휙 바뀌는 장면들도 너무너...
1,영화 내내 그리웠던 데카드쇼가 마지막에 쿠키에 나와 좋았음..ㅋㅋ영화의 스토리 배우들의 연기 모두 좋음..ㅋㅋㅋ 우주 영상은 먼가 엉뚱했지만..;;ㅋㅋ
1,시즌9까지 이렇게 재밌는건 유일무이한듯
1,원래 분노의질주는 이런영화다 부수는 맛에 보는거야
1,싸우고싸우고싸우고 화해하고 바베큐파티 국룰
1,분질은 개연성이나 과학으로 보는게 아님...끈끈한 가족애와 마초스러운 빈디젤...심지어 슈퍼히어로급.ㅋ그리고 이제sf세계까지!!생각없이 보면 이전작들과의 연결이 반갑고 액션이 통쾌하고 이만한 영화가 없음타노스가 와도...
1,예전 영화들에 비하면 좀 지루하다는 느낌이 있었음
1,이 영화를 보는 분들 암이 완치 되기를 바랍니다.정말 금고 훔치는 예전 그편이 너무 간절해지는 마음 이었습니다..미션임파서블처럼 역시 막판 30분이...
1,묻지도 따지지도 말고 아무생각없이 보시면 최고입니다.
0,우주는 좀 아니잖아...
0,"언제부터 분노의 질주에서 억지감동을 짜냈는지 모르겠네요 루즈하고 개연성 없는 전개, 액션씬도 이전 시리즈에 매우 못미칩니다 ㅠ 진짜 분노의질주 덕후로서 화나는 편이었고 중간중간 나오는 노래만 둠칫둠칫 좋았습니다 ,,..."
0,"말도 안되는..씨지와 액션을 엄청 때려 부어서 만든영화.. 보면서 계속 고개를 절레절레 하게되는 영화..  중간중간 잠 들었음존재 자체에 별 한개 , 노력에 별 한개."
1,생각을 하고 보면 개연성없는 스토리와 허무맹랑한 장면들로 약간 머쓱해질수 있는데 뇌를 비우고 나니 두시간이 신나고 즐거워졌다~진정한 킬링타임 ㅎㅎ
0,전편들에 비해서 너무 재미없고 영화니깐 그러려니 봤었지만 우주는 좀 선 넘었죠.. 기대하고 갔다가 조조라서 잠 왔습니다.
0,홉스앤쇼보고 기대했는데..
1,"어우 액션 영화를 되게 재밌게 보게 만들었어요. 데이트로 보기 굿굿농담도 정말 재밌고, 시원했어요 영상들이."
1,와 진짜 진심으로 너무 멋지다
1,분노의질주 : 자석놀이
0,"이전 시리즈 기대하고 보면 실망해요,, 너무 유치하고 루즈했음"
1,와 대박! 이생각만나게 해줌
1,말이필요없는 작품과 연기!! 믿고보는 영화가 맞네요 ㅠㅠ 이번편은 진짜 대박인거같아요
0,전작에 비해 스토리와 개연성이 부족해 재미가 없음
1,진짜 액션하나는 믿고 본다
1,결말: 피는 물보다 진하다
0,중반에 약간 지겹고 보다가 나갈까 갈등 억지로 짜마춘 스토리 차만 다부숨  돈아깝 나중에 티비로 보세요.재밌다는 사람 이해안될정도.
1,ㅈㄴ재밌다~~~ㄹㅇ
0,노잼..
1,개인적으로 분노의질주 시리즈를 좋아해서 이번것도 정말 재밌게 봤습니다
1,분노의질주 시리즈를 다본사람이면 찡한 감동이남는다
1,친구들이랑 같이 봣는데 재밋네요ㅋㅋㅋㅋ 애들전부다 액션에 넋나가서 몰입해서봤어요 그리고 빈디젤 목소리 진짜 개사기입니다 ㅠㅜㅜㅜ
1,너무너무 재밌어요!!
1,한시도 눈을뗄수없음보자마자 또 보고싶은띵작!
1,보다보면 흐음? 하기도 하지만 너무나 신나고 재밌는 분노의 질주가 맞다
0,이번건 너무갔다예전분노의질주 감성이 없어
0,액션은 좋았다. 그러나 영화라는걸 감안하더라도 받아들이기에는 너무 비현실적인 부분이 많아서 몰입도가 많이 깨졌다... 화려한 영상미는 좋았지만 스토리가 너무 억지스러운 부분이 많아서 눈은 즐거웠지만 머리는 답답하고 ...
1,숨안쉬고봤다..역시 분질임!
1,요즘 볼영화 없었는데 너무 재밌게본영화 꼭 4dx 로 보세요 그래야 이영화에 진가를 알수있습니다
1,보고있어도 또 보고싶다.
1,존잼 코로나 이후 역대급 영화
1,1편때와 같이 토레도 집에서 기도하며 밥을 먹는 장면과 마지막 스카이라인 등장은 시리즈를 계속 봐왔던 팬으로써 안 울수가 없었다.. 10편 11편 스핀오프 앞으로 확장될 분노의질주 세계관이 기대된다!
1,시리즈물 챙겨보는 유일한 영화. 나올때마다 액션에서 입이 떡벌어짐. 캐릭터 각각의 매력도 좋고 웃음포인트 내취향~ 중간에 화장실가고싶었는데 재밌어서 못갔음. 영상에 나오는 나라들로 여행가고 싶다.
1,와 개봉 첫날 9시에 가서 보고 왔는데 2년 기다린 보람이 있어서 좋네요 쿠키영상에 눈물 날뻔 했네요.. 폴워커 삼가 고인의 명복을 빕니다
1,역시 시리즈마다 실망을안준다이번역시 최고의점수를 주고싶다돈주고안아까운ㅋㅋ마지막엔 형제의찐한 애정이 역시 미워도 핏줄은모든게 용서가되는듯..오랜만에 스트레스확풀고왔음
1,분노의질주1부터 정주행 수십번한 골수팬들은 꼭보세요!!!!나만죽을순없으니깐^^
1,믿고보는 분노의질주.. 너무 좋아요 ㅜㅜ
1,마지막이 개쩌네 가슴이 웅장했다
0,솔직히...분노의질주 이제..옛날감성은 찾을수가없네요..이럴꺼면 그냥 첩보액션영화를 보지요..분질보면서 졸뻔한건 처음 ㅜ
1,역시 기대를 져버리지 않는 영화였어요 최고!! 즐거운 일요일을 보냈네요
1,킬링타임의 끝 이런저런 스토리를 떠나서 블루스크린 없는 액션은 이게 최고라 본다
1,재밌음 특히 한의 친구들이
1,차가 종이쪼가리처럼 박살나는 영화
1,솔직히 스토리는 모르겠는데 눈이 즐겁습니다 스트레스 풀림 말도 안되는 액션이 많지만 영화니까요 ㅎㅎ
1,영화가 정말 재밌네요 흥미진진합니다
1,전개가 조금 탄탄하지 못한데 액션 볼거리가 너무 탄탄해서 아무 문제 없었음 짱구는 못말려처럼 배우들이 액션을 막하는데 절때 안죽음ㅋㅋ
0,갈수록 힘이 빠지는구나...
1,액션신 하나는 정말 스릴있네요!
1,코로나로 축 쳐졌던 마음이 확 리프트 업 되고 스트레스 풀려요  액션이 쩔어요
1,재미있어요 1년만에 영화관 갔네요
0,시리즈 중 최악 중구난방 스토리
1,넘 꿀잼임 다 한 번씩 꼭 보셈
1,말이 필요없는영화!  영원히 보고픈 영화!!
1,2시간이 너무 짧게 느껴진 영화!! 오랜만에 제대로 된 영화로 힐링
0,영화가산으로 가다가 우주까지~ 보다 졸았
1,스카이 라인은 역시 파란색이지!
1,재밌게 봤습니다! 역시 완전 꿀잼
1,돈이 아깝지 않다라고 생각 든 손에 꼽히는 영화! 무~~~조건 4d로 감상하세요! 분노의 질주 고마워용ㅎㅎ
1,그냥 미쳤다는 말밖엔.... 마지막까지 기대를 주는 또 얼마나 기다려야 ㅎㅐ ㅠ
1,믿고보는 영화인건 맞다.그러나 이건 매니아들에게만 먹힐것이다.사실 이전 작품들에 비해서는 재미가 덜한것 같다.좀. 억지가 많이 들어간 느낌이다.마음은 10점이나 실제론 5점이다.
1,그냥 봐라 오랜만에 영화다운 영화 봤다
1,믿고보는 시리즈...이번에도 기대이상으로 너무 재밌고 감동 폭풍항상 보고나면 나도 운전 잘하고 싶다는 생각 뿜뿜!! 현실은 장롱면허.. 빼앰..!
1,빈 디젤 존 시나 존재감 진짜 지리네요
1,팝콘을 먹지못하는 영화관에서 봐도 팝콘의 부재를 느끼지 못할 정도로 재밌는 영화
0,시리즈 중에 최악임 개연성 박살에 우주가는거 너무 별로였음
0,시리즈 중에 최악임 개연성 박살에 우주가는거 너무 별로였음
1,흑형녀들보고 바로 화장실가서 하고옴..
0,제발 보지마세요   플리즈....
1,분노의 질주에서 버진갤럭틱 테스트 비행 성공 암시했던거네 ㄷㄷ
0,액션이 많은것도 아니고...좀 지루하기도했고 8편보다 별로일줄은...시간은 금방지나감
0,다음 편에서는 더 나은 모습 보여주길...
1,하다하다 우주까지 가버렸네 ㅋㅋㅋ 개꿀잼^^
1,이영화를 찍기 위해서 자동차 117대가 파손되었다는것이 사실입니까?
1,그냥 완전 재밌는데요?
1,그냥 봐라
1,역시 분노의 질주!  너무 재미있게 봤어요.
1,진짜 쾌감 쩔어서 소리치면서 보고 싶었음
1,오랜만에 액션 뽕에 한껏 취하고 왔다
1,이건 무조건 극장에서 봐야 해요
1,축구선수 음바페가 나온줄 알았어요.다음편에는 한과 쇼의 화해 그리고 항공모함이 나오지 않을까 합니다
1,액션과 유머까지! 유쾌하게 볼 수 있었네여~
0,비현실적인 액션만 마니 나오고 정신없고 끝인듯요..드웨인 죤슨 나오는 영화랑 비슷함..
1,분노의 질주 시리즈는 처음 보는건데도 너무 재미있었어요!! 액션씬도 지루하지 않고 두시간 반이 후딱 갔어요 ㅜㅜ 진짜 또 보고싶어요
1,생각보다 진짜 더 재밌었음ㅠㅠ
1,진짜 액션 장난아님 개 추천 ㅎㅎㅎ
1,액션도 액션이지만 배우들이 하드캐리ㄷㄷ
0,나만 당할 수 없지 ㅋ돈 버릴거면 보셍 ㅠㅠㅋ ㅈㄴ 볼수록 현타옴
1,"엔딩까지 완벽하잖아,,, 쿠키 무조건 보고 나와야 됨..."
1,음악이 우주로 날아가게 합니다실제 우주로 날아갈까요???
0,총 왜쏘냐 ㅋㅋㅋ맞지도 않을 총인데
1,혹평이 많은것 같은데 분노의 질주 시리즈를 즐겨봐왔던 사람중 한명인 저는 정말 재미있게 보고 왔습니다. 혹평 중 하나가 현실성이 없다는 것이었는데 영화라는 가정하에 보면 그것 또한 재밌었어요 ㅋㅋ 스토리도 나쁘지 않...
0,재미없던데 너무 허무하고 어이없음
0,뇌를 비우고 보라고 했는데 비우지 못했다. 개연성 하나도없는 그냥 때려부수고 쾅쾅하다 끝나는 영화.
0,존나재미없어뭐라는거야
0,이 영화를 재미있게 보려고 더 내려놓을걸 찾다가  득도함....
1,역시 말이 필요없다 ㅎㅎ
0,원래 분노의 질주가 억지로 가득찼지만 이번편은 진짜 가관임 이게 감독이라는 직업을 하는 사람이 만들수있는건가...라는 생각이 들었음
0,말이 안되는 스토리. 후속작은 이제 끝? 더 나올 액션이 없을듯. 와중에 동생빌런맡은 배우 짱 멋짐.반디젤은 이제 늙었어
1,액션 스케일은 진짜 시간가는줄 모르네요~ 다소 황당한 오바스토리도 있지만..그냥 액션취향이시라면   찐입니다
1,너무 멋진 액션과 탄탄한스토리! 시간가는줄 몰랏다 . 역대급임~~!
1,미친듯이 달리는 액션에 마스크를 쓰고있어도 시원함
1,액션맛집입니다 또 보고싶네요
1,여기서 존시나 나온다는 줄 상상도 못했노
1,뇌를 어디까지 비워야하나...?
1,ㅋㅋㅋ 갑분 인터스텔라
1,존잼존잼존잼존잼존잼
1,와 진짜 너무 재밌음... 4d로 봤는데 간만에 재밌는 영화 보고 온 거 같음 무조건 4d로 보세요
0,알바들 장난에 속지 마세요.조조 영화 보면서 졸기는 처음이네요.ㅠㅠ
1,항상 최고지 뭐.. 성 강 다시 나와서 더 반가워요.
1,거지같은 영화들도 그럴줄 모르고 돈 내고 잘들 봤을거아냐ㅎㅎ이런 영화야말로 돈 딱딱내고 대형 스크린에 빵빵한 사운드로 즐겨줘야지ㅎㅎ뭘 망설이니ㅎㅎ 중간 중간 음악도 너무 신나서 맨 뒤에서 춤추면서 봤음ㅎ 물론 뒷자리...
1,진짜 미쳤다 보는 내내 감탄함
0,꼭 어렸을 적 봤던 벡터맨같네요..
1,탄탄한 스토리와 액션이 돋보이는 오락무비
0,영화가 산으로 간게 아니라 우주로 가는거 보고 한숨 푹쉬었다
0,아무리 영화라지만 말도 안되는 영화같은 일들의 연속이 영화를 유치하게 만든 느낌이네요나중엔 실소가 나오더군요
0,별 하나주기도 아까움..ㅜㅠ  보다가 나옴.평점 왜 높은지 이해불가
1,분노의 질주는 항상 믿고 보지요^^
0,"별 감동도 재미도 없음, 평점이 왜 높은지 이해불가, 스토리 몰입감 없고 액션도 허무맹랑"
1,액션영화 팬이라면 놓칠수 없는 시리즈
1,분질은 언제봐도 진짜 멋있는거 같아요
1,너무 재미있게 봤어요. 액션이 통쾌하더라구요. 마지막에 쿠키 영상 있으니 끝까지 보세요.
1,아 로만 사랑합니다 당신의 위트는 대사가 아니라 사람이네요
0,진짜 별로다 아무리 시간 때우기용으로 본거라지만 그냥 때려뿌시고 끝이네 뭐 개연성도 없고..
1,와우 개인적으로 시리즈중에 최고인듯 !
1,"인생 최고의 영화정말 출연진도 너무 좋고, 이번편 너무 재미있게 봤다!1부터 봤는데 최고다, 다음 편도 기대한다!!"
1,지루한 부분 1도 없이 집중하면서 봤어요. 진짜 재밌음. 강추
1,잠깐의 지루함도 없었어요~
1,정말 화면 연결도 자연스럽고 사운드도 너무 좋았습니다 돌비 시스템을 기반으로 만들었다고 하니 돌비관에서 보시면 좋을것같아요! 사운드가 어찌나 좋던지 의자도 흔들릴정도..
1,오늘 스트레스 해소할 겸 봤는데 스케일 장난아니고 액션씬도 굿!!!
0,역대급쓰레기 한국영화 보는줄 알았어요
1,이번 시리즈는 진짜 미쳤네여ㅋㅋㅋ
1,시즌을 더할때마다 더 재밋어지는 분노의질주
1,역시 분노의 질주는 믿고 본다 안 그래도 요즘 영화 보고 싶었는데 분노의질주는 다시 시리즈 별로 봐야 할 듯
1,분노의 질주 시리즈를 모두 본 팬 분이라면 닥관.본 적이 없는 팬이라 하더라도 닥관.어벤져스 엔드게임 급 팬서비스
1,ㄹㅇ ㅈㄴ재밌다 진짜러...
1,내가 생각한것 보다 더 재밌었다
1,진짜 기대를 저버리지 않음 ㅠ
0,관객을 분노하게 만듬...!!
0,흠... 글쎄요...ㅜㅜㅜㅜ
1,"분노의 질주 시리즈  좋아해서 오랜만에 영화관 찾았는데 너무 신나고 재밌었다. 스케일 장난없고, 신나게 깨부수는 액션 간만에 감동이였음. ost도 한몫하고.스트레스 날려버릴 수 있어서 좋았음."
1,갈수록 진화하는 분노의 질주 시리즈
0,액션좋아 근데 노잼.. 아시안 좀 안나왔으면 좋겠다. 조합이 아시안 흑인 백인 제발 백인만 나왓으면
1,우리 아빠도 재밋다고 ㅋㅋㅋㅋ같이 또 보러갈거에요ㅋㅋㅋ
0,이게 9점대라니...의리&알바의 결과물인가..난 남아있던 의리도 사라졌다..개노잼
1,이건 무조건 극장에서 봐라 진짜 ㅡㅡ
1,초반에 약간 지루한 부분이 있었지만나중에는 잼있었어요
0,이건 좀 선넘네요 너무 억지스러워서 보는내내 불편했네요
1,이거 보려고 전편 다 보고 보러 갔더니 더 재밌어여
1,케미 미쳣음 ㅋㅋㅋ진짜 꿀잼
1,액션 무엇...? 딱 우리나라 사람들이 좋아할 오락영화
1,도미닉 패밀리 사랑합니다
1,액션 유머 감동 다 갖춘 오락 영화임 무조건 강추
0,진짜 최악의 영화다 영화관에서 보다 나오긴 또 처음이네...내가 내돈 내고 왜 광고를 보고 있어야 하는건지 스토리의 개연성 개판이고 진짜 뭐하자는건지..캐스팅만 좋고 다른건 다 -100점
0,기대하고 기다려서 봤는데..분노가....ㅡㅡㅎ
1,연출 액션+ 감동반 재미반 정말 재밌게봤습니다 !
0,과거 회상에 신파에 구구절절 가족애 강조...역대급 노잼그리고 호섭이 머리를 해도 샤를리즈테론은 예쁘더구만
0,그냥 보는 내내 웃다가 나옴
0,기승전 액션임. 좀 지루함.
1,너무재밋게잘봣습니다
0,진짜 인생 역대급 노잼 영화
1,이 시리즈는 대체 한계가 어디일까...미친듯이 재밌네
1,"남자친구가 재미없다고 하면 헤어질 듯 없지만,,ㅋ"
1,"연출이 너무좋고, 중간중간 퐝 터지는 재미에 너무 좋았습니다"
1,말이 필요하나 1부터 다시 정주행이고 하나하나의 감동 .. 마지막 워커 형님 차량..하 눈물이
1,동생이 요즘 독박육아 때문에 힘들어해서 일부러 엄마찬스써서 심야로 둘이 영화보러 다녀왔는데 진짜 완전 탁월한 선택! 있는대로 사정없이 막 때려부수고 미친듯이 달리는데 그것만으로 쾌감 50000% 저도 요즘 회사 스트...
1,가슴이 웅장해진다액션이 너무 어이없어서 웃음이 나온다 개그포인트는 로만과테즈의 티키타카가 아닌 액션이었다
1,친구따라 본건데 너무 재밌네요ㅡ.ㅡ
1,이번에는 남캐 여캐 다 조합이 좋더라구여ㅎㅎㅎ 꿀잼입니당
1,존 시나 전신화보 튀어나온 푹신함
1,정말 오랜만의 영화다운 영화를 본듯합니다역시 분질 최고창원 더시티cgv 오늘온도 30도인데 에어컨도 안틀어주고 사우나인줄 알았음ㅡㅡ
1,다들 케미 장난 아니네 ㅎㅎ
1,재밌었어요 ^^ㅎㅎㅎ시간가는줄 모르고 봤네요
1,역시 믿고 봤습니다 ㅎㅎ 최고네요 ㅎㅎ
1,액션은 두말할거 없고 마지막 파란 고질라 보고 온몸에 소름 차 좋아하는분들은 파란고질라 뭔말인지 아실겁니다ㅎ
1,굿재밋더요 많이마니재밋더요
1,즐기기 좋은 오락 영화네여 간만에 스트레스 확 풀려요
0,머지..이거 넘 한거 아냐? 말도 안되는 전개.스토리.기다고 기다리던 영화인데 실망이 넘 크다.
0,절단났네 안타까움 ㅜ....
1,도미닉 동생 진짜 매력 철철이네유?ㅋㅋ
1,보지 마세요  시간  돈 아까움
1,우주로 가버리는 시나리오에 내 뒤통수는 이미 뇌수에 절어 있었다.
1,진짜 계속 집중해서 봄 시간 순삭임요
1,정말 재밌음 강력추천!! 오늘 이거 봤다ㅎ
1,웃음 재미 감동 다 잡은 오락 영화입니다
1,보는내내 정말 행복했어요
1,편하게 보기 좋은 오락 영화입니다아
1,전작들도 훌륭해서 기대반 걱정반이였는데ㅋㅋㅋ 걱정 노노
1,킬링타임용으로 딱 즐기기엔 좋아요
1,오랜만에 볼만한 액션 오락 영화가 나왔넹
1,4D로도 보고싶어요... 아 첨부터 4D로 볼걸...
1,그냥 최고속이 시원하다
1,"가족, 친구, 연인 누구와 봐도 재밌을 오락 영화"
0,그저그런영화 ^^..
0,인랑이후 잠들려고 하면 총쏘고 잠들려고 하면 차돌고
1,솔직히 너무 잘만듬.ㅠㅠㅠ
1,엔딩이 미쳣어옄ㅋㅋㅋ아 ㅋㅋㅋ
1,재밌어... ㅠㅠㅠ꼭보세요!
1,웃음 포인트도 많고 시간 가는 줄 모르고 보게 됨요 ㅋ
1,맛깔나는 연기들과 유쾌한 연출!! 보는내내 즐거움+_+
1,분노의질주 대표작이 바뀌었음ㅋㅋㅋ
1,진짜 리얼 찐 재밌다 ㅠㅠ
1,우주 다음은 지구 내핵?
1,친구들 다 끌고 가서 보고 옴  개재밌다
1,빈디젤 입덕ㅋㅋ 너무 멋진거 아닙니까ㅋㅋ
1,네이버에 로그인해서 쓰는 두번째 리뷰인데 찐 감동! 코로나 이후 거의 1년 반만에 영화관에서 봤는데 스릴감 박진감 넘쳐서 롤러코스터 타는 기분으로 봤습니다
1,완전 대박!!! 세계 최고의 영화!!!
1,재미와 감동 시간 가는줄 모르고 봤어요
1,블록버스터를 보고 싶다면 추천.
1,두번째관람 말이 필요없음 최고!!!
1,스토리는 전작처럼 흥미진진하진않았는데 저는 마지막 여운이 가장남네요..
1,이게 바로 분노의질주다!!
1,스토리 구성 최고 배우들 연기가 작살납니다~~
1,너무 잼나 ㅋ또 보구싶당ㅋㅋ
1,간만에 속 시원하고 감동적인 영화 봤어요~~~
1,재미와 액션 두 마리 토끼 다 잡은 작품
1,재밌게봤어요 또보구싶네요!!!
1,신나는 영화였습니다. 스트레스가 확 풀려요!!!
1,크…… 재미감동코믹액션 한번에 다잡음
1,진짜 시간 가는줄 모르고 봤습니다 강추합니다아
1,지루할틈이 없이 재밌게 잘 봤습니다
1,진짜 액션 맛집이네요ㅋㅋ
1,긴장감과 박진감 넘치는?! 거기다가 웃음까지 있고 넘 좋았다!
1,군더더기 없는 오락 액션 무비
1,미쳣다 이영화 ㅋㅋㅋ 왜인기 많은지 알곘음
1,스트레스 확 풀리는 기분이랄까
1,한번도 지루함없이 끝까지 잘 보았네요ㅎㅎ
0,역대 최악이 아닐런지...
1,시간 가는줄 모르고 너무 몰입해서 봤습니다
1,스트레스 해소에 이만한게 없죠
1,캬ㅋㅋ 웃기기도 하고 재밌게 봤습니당ㅋㅋ
1,아직 못보신 사람들은 얼른 보러 가세요~
1,시간 가는줄 모르고 봤네요. 기대한 만큼 재미있게 잘 봤습니다.
1,기대이상으로 너무 재밌음 ~
1,제목 한번 잘지었네 ㅋㅋ 완전 얼티메이트급!!
1,이거 진짜 찐이야~
0,우주가는건 좀. . 그리고 총바로앞에서 쏘는데 한발도안맞네 ㅋㅋㄱ
1,토레토 가족의 죽지않는 자석 과학 실험
0,취향 안맞으면 재미가 없을듯 싶습니다.그냥 달리면서 때리구 부수는 단순한 액션정면에서 총을쏘는데 절대로 맞지 않는 주인공1vs10을 싸워도 이기는 주인공뭔가 어설픈 감동설정과 개그포인트빈약한 스토리와 가족애를 강조하...
1,1편부터 회마다  스케일이 커지더니 급기야 우주공간까지 영역확장. 이러다 다음 편에선 달  그 다음엔 화성으로까지 영역 획장할 듯. 간만에 극장에서 본 영화중 최고!
1,분노의질주 처음보는데 재미있게 봤숩니당
0,정으로 좋게주는거?..그래도 액션은 좋았던 홉스앤쇼보다 액션도딸리고 영화 자체 재미도없고..
1,자석을 사용하다니 너무 창의적 !! 대박 다음편도 너무 기대됩니다!
0,자동차 영화이지만 자동차는 많이 나오지도 않고 액션은 쓸떼 없고 내용은 홉스 앤 쇼와 비슷하여 영화본 시간이 시간 낭비라는 시간이 들 정도로 재미가 없었음. 이 영화는 비추.
1,분노의질주 시리즈를 한번도 본 적이 없는 사람으로 엄청 재미있게 봤습니다. 마블 시리즈랑은 또 다른 매력과 유머코드를 갖고있는데다가 볼거리가 많아서 정신없이 집중해서 봤네요!!
1,분노의질주는 전 시리즈가 다 재밌어ㅠㅠㅠ또 보러 갈 예정
0,예비군2년차가 뽑은 최고의 비현실적 영화
