score,text
1,"메시지는 차치하고 감각적으로(시각, 청각) 황홀했다. 영화는 가능하고, 소설은 불가능한 것. 영화는 도달할 수 있고, 소설은 도달할 수 없는 것. 영화는 체험시킬 수 있고, 소설은 체험시킬 수 없는 것. 더 확장하면..."
1,"개봉일을 기다려, 모처럼 팔순의 친정어머니와 롯데 시네마에서 보았어요. 잔잔한 시냇물이 흐르는 계곡에 미나리 밭을 일구는 우리들의 어머니 또는 할머니의 강인한 생존력이란! 대지의 후손들이라면 누구나 배꼽 아래 단전으..."
1,하....  이것이 제 심사평입니다. 이런 게 바로 영화 아니겠습니다. 오늘 하루 하.. 할듯..
1,평양냉면 같은 영화. 막상 기대했다가 보면 이게뭐야? 할지도 모르지만 극장을 나선 뒤에도 잔잔하게 울림을 주는 영화
1,"이 영화자체가 미나리같다. 그리고 이 영화에 나오는 인물들도 미나리같다. 특별하고 화려하진 않지만 강인하고  자꾸 머릿속에 이 가족의 현재와 미래가 궁금해지고 응원하게 된다.그들의 모습속에서 가장으로써의 모습, 어머..."
1,"부모님의 높아지는 언성에 숨어서 마음 졸였던 아이, 축축한 이불에 몰래 흔적을 지웠던 아침, 그저 풀 위를 달리고 싶었던 순수했던 마음, 그리고 그 때는 보이지 않았던 아버지의 삶의 무게까지. 잔잔하지만 재치있고, ..."
0,실망이 컸던 영화. 명성에 못 미침
0,재미없음니다  정말로요
0,모르겠네요..영화가 끝나고나서 고개만 기웃..이게뭐지?그닥 큰내용도 없고  영상미도 없고  ..여튼 전별로였네요
1,너무나도 평범해서 아름답다
0,솔직히 크게 연기력을 극찬할만한 영화는 아닌듯 그정도로 연기할만한 배우도 여러명 생각날 정도로 크게 감동할만한 연기력은 아니었음 스토리도 잔잔한건 각오하고 봤지만 딱히 감동으로 다가온것도 없었고..막내 데이빗은 참 ...
0,이게.. 감동이라는..?도데체 왜?
0,기대에  다소  미치지 못함이 있었던듯 하다어   ~   이케 끝났어  하는 느낌 뭐지
0,작품의 만족도가 많이 부족하다
0,너무 기대하고 어머니랑 영화를 보러 가서인지사실실망이 좀 컸습니다.. 외국에서 상을 받을 정도인가 라는 생각을 하게되더라구요. 내용구성이나 배우들 연기면에서 너무 아쉬웠습니다. 작품 연출이 너무 아쉽네요.. 휼륭하신...
0,장난하나. 나만 당할 수 없지 다들 보새오!
1,데이비사  (영화 넘 여운있고 먹먹하네요. 영화보며 이런 감정은 처음입니다)
1,흐르는 강물 영화가 생각나는 잔잔함과 가족애로 감동을 주는 영화였습니다.  ‘할머니가 자리를 잘 잡으셨네’ 엔딩의 대사는 여운이 남습니다.  미나리가 연약해 보이지만 바람결에 흔들리면서 보이는 장면은 한국 정서가 함...
0,기대가 높았나보다. 연출 스토리 모두 기대이하다.
0,과대평가된 영화.연기도 스토리도 그닥
1,To all grandmas 엔딩 크레딧이 올라올때 흑 들어오는 감동이 있습니다. 정이삭 감독 자전적인 이야기라 리얼리티가 살아있는데다 윤여정 배우의 넋이 나간 연기가 너무 좋았습니다
1,"질긴 생명력과 적응력으로 어디서든 잘 자라는 미나리처럼,우리도 그렇게.  원더풀 원더풀 미나리."
1,"신파로 빠질 수도 있는 내용을 담백하게 그려낸 연출, 배우들의 빼어난 연기. 1년 만에 극장 나들이 한 보람이 있었다."
1,"표면적 주제인 이민을 떠나서, 인생을 살아본 사람이라면 격하게 감정이 몰입되어 펑펑 울게될 것이다. 남자의 내면과 여자의 내면과 할머니의 내면과 손자손녀의 내면이 각자 정당성을 가지고 어떻게 갈등국면을 돌파하는지를 ..."
0,ㅎ....뭐지 도대체 내가 뭘 본걸까요
0,노감동노재미 입니다  ㅠㅠ
1,가장 개인적인 이야기를 꽤 보편적인 형식에 담은 영화인 것 같다.
0,모든 가족의 스토리를 다 이야기하려니산만하고 감정선 처리가 너무 약함마지막 결말은 싱거워서 뭐냐 이런 드립이 저절로 나옴
1,잔잔하게 덤덤한 표정과 감정섞인 눈빛으로 이야기를 들어주는 사람 같다별거 안했는데 앞에 있는 날 울려버린다그렇다고 집가는 버스에서 운건 아니지만음 안 운 것도 아니다아빠 그리고 엄마 우리 가족 그리고 나 모두가 떠올...
0,기대를 너무 했나 봅니다. 솔직히 실망하고 나왔어요.
0,생각보단  전체적으로 허술한점이 많네요연기도 와닫지 않고요 서양사람한테는 감동이있었나보네요  그정도의 연기는 우리나라 조연급들이 누구나 할수있을것같네요
1,잔잔하고 감동스러웠습니다. 방학때면 외갓집에 갔었던 행복한 기억과 지금은 많이 편찮으신 외할머니가 동시에 떠올라 그립고도 눈물이 났습니다.
0,그냥 그래요 열자이상 뭘 쓸지도 모르겠음
1,"인생이란 그런 거지 잘 될 줄 알았던 일이 꼬이고,안 될 줄 알았던 일이 풀리고.그 과정을 함께해 준 이들이 있어내 인생을 폐기하지 않을 수 있었던 거겠지"
0,"하,,삼겹살에 미나리 구워먹는게 더 재밌겠네"
1,담백한 연출이 좋았어요
0,글쎄.... 영화가 무슨 말을 하고자 하는지는 알겠으나.. 스토리에 비해 러닝 타임이 너무 길고 늘어지는데에 비해 마무리는 급하게 끝내는 느낌.. 이게 왜 높은 평가를 받는지 이해하기 힘들다
0,난세상에 태어나 진짜 재미없는 영화를 보았다. 패주고싶다 미나리 극찬한 광고성 메스컴들에게..
0,나만 별로였나...??
0,너무 지루함 .... 잠올정ㄷㅗ로
0,"기대했으나 영상미,bgm,연기,스토리,감동,재미 어느것 하나 눈에 띄는 부분이 없었다. 대체 왜 평점이 높은거지- 이야기의 맥락을 모르겠고 ㅠㅠ 이영화 뭘 말하고 싶은거지?"
0,..내용이 그냥 당황스러워요
0,생각보다 아쉽습니다ㅠㅠ
0,지루하다 지루해.. 그래서 결론이 뭐임
0,무슨 영화인지 감동도 재미도 ..ㅜㅜ
1,서사가 극적이지 않아서 어디서 어떻게 반응해야 하는지 감을 못잡는 분들도 계실 것 같습니다. 하지만 저는 있는 그대로 보여주었기 때문에 느낄 수 있던 잔잔한 감동과 여운이 있었습니다. 가족이기 때문에 쉽게 서로에게 ...
0,미국 이민자들에게 큰 감동을 줄만하지만 그외의 관객에게는 그저 잔잔한 서정적인 영상에 불과할 듯
0,그냥그냥... 그냥...
0,할말이없음 내용이없기때문에
0,뭐가 좋은지 알 수 없는 영화
1,가족의 힘이 이토록 대단한것이었다는걸 느끼게 해주는 영화 였다
1,극적반전은 없지만 짜임새 있는 스토리와 잔잔한 감동이 있네요 오랜만에 좋은영화 봤네요
0,"매씬이 아슬아슬. 어색함에 조마조마. 모국어와 자막, 히어링과 리딩 사이. 평가도 감동도 이토록 왜곡된다. 소신 별점을 방해하는 수상이력의 압박까지. 내가 본 윤여정의 가장 어색한 연기."
0,무슨 내용인지 모르겠어요 .. 의미 감동 다 없음
0,진짜 뭘얘기하고싶은거며 방구석 평론가들때문에 너무 고평가된 영화
0,연기력? 특출난거 없는 흔한 연기력...감동? 흔한 3류 영화나 드라마에도 나오는 밍밍한 감동포인트...무엇보다도 심각한건 갑작스런 결말...
1,"미국은 애초에 태생적으로 “이민자”의 나라다.. 아메리칸 드림을 이뤄내고자 하는 다양한 인종의 사람들이, 저마다의 사연을 가지고, 그들의 장점들을 최대한 되살려 직업에 종사했고, 결과적으로 세계 최강국의 원동력의 중..."
1,"아무데서나 잘 자라는 미나리, 우리는 그럼에도 구태여 삶의 뿌리를 내리려고 노력한다."
0,머때문에 이영화가 상받았는지 이해가안감!영화사곧 망하겟네.ㅋ
0,평점 실화임...?영화가 뭘 말하고자 하는건지 모르겠네요.
0,전형적인.일벌려놓는 옛날 우리네 아빠들 이야기같아서 속이답답했네요 참다보면 좋은날이온다는게 팩트일까요
0,노잼 . 직설적으로말하자면 오스카국뽕끼가 많다 .
0,하나 같이 연기자들 연기가 붕뜬 어색한...   저마다의 따로 국밥식 연기에 1점
0,걍심심풀이용 재미없음
0,생각보다 많이 별로였어요.  결말도 그렇고 마치 10부작 드라마중 1부만 본것같은 느낌.
0,영화에 재미를 빼면 그게 무슨 영화임? 고문이지ㅋㅋ
0,다 알바인 거 같다...
1,스티븐연 한국어 진짜 연습 했나보다ㅋㅋㅋㅋ 한국어 발음이 안어색해
1,궁금해서 개봉하자 마자 봤습니다.  자연은아름답고 넓지만 미국이민 시골생활 많이 힘들었겠어요
1,다 잃고도 다시 시작하는 모든사람들에게 응원의 박수를 보내고싶은 뭉클한 이야기
0,서양인들은 이걸 보면서 어떤 감동을 느낀 걸까요 미나리 즐겨먹는 김치맨은 이 영화의 가치를 전혀 모르겠네요
0,데치기만 한 아무 양념도 없는 미나리 나물. 어떤 감동도 느껴지지 않았다.
0,미나리 수상 이유.코x나로 개봉 영화가 없어서.
0,갸웃뚱? 잘 모르겠어요.마지막 앤딩장면...기대에 부응하지 못한 영화...
0,"가장 큰 문제는 스티븐 연이 연기를 잘 못한다.,,이다."
0,2021.03.07 (일) 2시간이 사라졌다
0,기대에 많이 못미치는...감동이 없어 아쉬운 영화입니다
0,무얼 연출하고싶은지 몰르겟어요결말도 어이없고..
0,이게 왜 상을 받은건지 모르겠다. 2배속으로 보고 싶어질 정도로 한장면 한장면이 늘어지는게... 지루하다는 느낌
0,...이게뭘까....되게 어색한 다큐를 보는데 별 내용도 없더라..
0,가슴에 손을 얹고 말해보자...이게 재미있냐?ㅋㅋㅋ 외국에서 상 하나 던져주니 아주 대단한 작품인 것처럼 생각하고 빨아대는 모습이 왤케 웃기냐
0,다들 좋은 평을 내고 있는 마당에...감독과 제작진 거의 모두 한국인이 아닌데 너무 많은 매스컴에서 마치 자랑스런 한국인이 만든 한국영화인냥 은근슬쩍 작품국적을 둔갑시키고 있다는 생각을 했다. 전형적인 동양여성의 외...
0,"기대를 너무 많이하고 봐서 그런지 아쉬웠어요. 초반 설정 빼고는 뒤로 갈수록 너무 지루하고 감독의 메세지도 전 잘 모르겠어요 ㅠㅠ 한예리씨 팬인데도 불구하고, 연기도 아쉬웠고 윤여정님은 가지고 있는 매력을 1도 못보..."
1,모두들 연기가 넘 좋았습니다.
0,개노잼 수면제 영화윤여정 연기는 잘하는데 무슨 상을 휩쓸만한 그정도는 아닌듯
0,솔직히 재미도없고 감동도없고...왜 상탓는지 의문이들정도...
1,한국영화 특유의 억지스러운 신파없이 아주 절제된 감정으로 너무나 잘 풀어낸 영화. 여운이 정말 진하게 남는다. 마지막 할머니의 '실수'가 가족에게 '구원'이 되었다는 것이 정말 아이러니하...
0,평점보고 속아서 봤는데 정말 실망했네요 감동포인트도 없고 결말도 이상하고 중간중간 똥개그 없었으면 무표정으로 끝까지 봤을듯하네요
0,전 너무너무 공감이 안됐어요
0,지루하고별로네용....노재무
0,아무것도 모르고 영화순위높은것만 보고 봤는데 뭐가 더 나올줄알고 엄청 집중해서 봤는데 그냥 그대로 끝났네요..딱 끝나면 뭐지?싶어요...연출이랑 몰입감은 좋았고 현실적이였어요 하지만 저한테는 좀 지루했어요..
0,이 영화가 개봉되기를 기다려왔다. 보고싶었고 궁금했다. 그리고 오늘 영화를 보았다. 기대를 떠나서 최소한의 영화적 감동선이 있어야 하는데 보는 내내 고개를 갸우뚱할 수밖에 없었다. 스토리도 영상미도 없었다. 그랬다는...
0,재미 진짜 없음 이 여섯 글자도 아까움
0,무엇을 말하려는건지 그냥 평범할 남의 일상을 돈내고 보는 낭비
0,한줄평 첨 써봅니다. 휴
1,내밀하고 진솔한 경험이 우리 삶의 놀라운 찬가가 되다.
0,미나리는 미국영화이고 미국인 브래드 피트가 제작자이고 미국인이 감독인 영화다. 그 영화에 한국인 여배우가 등장을 했다. 한국인이 제작자였고 한국인이 감독이고 제작비가 20억이었다면? 작년에 심은경은 아카데미에서 주연...
0,보는 내내 짜증난건 나만 그런가...
1,자극적이지 않고 담담해서 더 가슴을 후벼파는 영화... 주변 어딘가에서 한번쯤 들어봤을 법한 이야기라 더 그렇다
0,진짜 영화가 너무 평범하다 못해... 아.. 연기력은 그냥 너무도 평범했다. 솔직히 왜 상을 받을만했는지 전혀 이해를 못하겠음. 감동도 재미도 전혀 없는 그런 영화.
0,여러가지 상을 휩쓸어 호기심과 기대감으로 모처럼의 영화관 나들이를 했는데 결론 부터 말씀드리면 대실망~ 허탈합니다. 스토리 진부하고 배우들의 연기는 그저 평범 그이상 이하도 아님! 감동이나 메세지도 전혀 없는 딱 삼...
0,영상미 음악은 좋으나일단 영화라는 건 재미 있어야 되지 않나 싶다돈 아깝다
0,쌉노잼이였어요 돈아까워라
0,솔직히 돈아까움
0,평점이 왜 높은지 이해가 안되네요..보는내내 지루하고 윤여정의 연기는 그닥 잘 하는지 모르겠더군요.솔직한 객관적 생각입니다..
0,드라마 시티 아칸소판... 코로나로 영화가 없으니..
0,저 지금 봤는데요이거 무슨 ㅡㅡ 내용이 없는데요??? 주말 두명에 거의 4만원 돈 내고 봤는데아 진짜 장난하나ㅋㅋ영화광 저희 엄마가3처넌 짜리 독립영화 수준이라며ㅋㅋ뭐 다 느끼는 바가 다르겠지만정말 돈아깝네요 ㅋ...
0,이게 솔직히 재밌냐? 시간아까움
0,갑자기 싸운다고? 갑자기 병 걸린다고? 갑자기 낫는다고? 갑자기 불난다고? 이렇게 끝난다고??? 미나리는 갑자기 왜나온건지 어디서나 잘자라는것 만 가지고 억지로 같다붙인.. 배우가 아깝
0,돈 아깝다. 솔직하게들 후기 적어주세요. ㅠ ㅜ 국뽕에 취해서 뭐 있는듯이 하고들 있지만 솔직히 돈 아깝짆아요. ㅠ 실망스럽잖아요... ㅠ ㅜ
1,담담하고 담백하고 담대하다
0,50대여자친구셋이함께봤다.다들화가많이나서헤어졌다..너무지루하고졸려서힘들어했다.ㅠㅠ
0,진짜 ㅈ노잼인데 댓글알바가 양심챙겨
1,데이뷧 너무 커여워 ㅋㅋㅋㅋ퓌퓌~
0,잔잔하긴 하더라...근데 경의적인 모우먼트는 없더라.글쎄..
1,"어느 곳이든지 뿌리 내리고 잘 자라는 미나리와 같은 우리들의 삶을 그린 영화. 사실적이어서 아프기도하지만 또 사실적이어서 따뜻하다. 코로나로 삶이 많이 변화 한 오늘도 우리 모두 적응하고 살아가는 것처럼, 그럼에도 ..."
1,최고의 수혜자는 브레드 핏 ! 감독은 소설같은 전개를 영상으로 잘 펼쳤고 문학적 베이스가 매우 탄탄하다고 누껴졌움
1,친정엄마가 생각나고이민자들의고단한 삶이가슴이 먹먹합니다
0,평점 10점씩 준 놈들 유튜브 광고 5초도 제대로 못참을 놈들이 태반일 텐데 지적허영심에 걸려서 이딴 재미도 없는 영화 잔잔하다느니 뭐니 빨아주는 거 보면 개극혐 ㅋㅋ 보다가 너무 지루해서 휴대폰으로 계속 몇 분 지...
0,기대이하 어처구니없는 전개 머지? 소문난잔치에 먹을게없다 연기력도 그렇고 어이없는 끝맺음잔뜩기대하게 해놓고 ???  기대하고본다면 진짜 실망할것
0,북미에서 외래종 식물인 미나리를 저렇게 무개념하게 심어서야...한류(미나리)를 심어서 미국 토종을 작살내고 번성하자는 모티브인가
0,간만에 꿀잠 잤다 이딴것 만들지마라
0,"이렇게 내용도 없고, 잼없는 영화 첨 봄."
0,별루내요 근대 머때메 날리난것만냥 온방송 마다 나오는지 대통령 연설보다 방송5체널에서 방영을 해대내요 그정도는 아닌가요 돌리는체널 마다 미나리 미나리 미나리 미나리 미나리먹고 미첫나요 외들그러는거에요 낮에 체널 돌리...
0,영화 전부 엉망진창 이다
0,아니 이게 대체 뭔 내용이여엑소시스트임 미나리 캐는 내용임
0,미나리에 삼겹살이 더 맛있습니다
0,감동 흥미 다 내 관점에선 아니다...보고나니 낚였다는 기분밖에 안든다...
0,봉준호 감독이 보편적이고 아름답다라고 말한걸 자랑스럽게 예고편에 영상에 넣었는데 ;;; 보편적이다는게 결국은 흔하다는거 아님?
0,내 잃어버린 115분은 어디에?
0,와 무슨 아카데미상 수상했다길래 네이버시리즈온으로 결제해서 봤는데 노잼도 이런 노잼이 없다 절대 돈주고 보지마세요 무료로 풀리면 보세요
0,"아니, 대체 이게 뭐야...."
0,꿀잠용 영화. 평점만 높게 나오는 재미없는 자칭 평론가들 그들만의 리그
0,같은 미국인이 만든 미나리는 고용창출도 안 되는 데 호평일색이고 고용창출 쿠팡은 왜 욕을 먹지? 한국인의 이중성이란 참
0,"개연성과 주제의식이 없음보편적인 이민1세대의 삶을 그렸다기엔 가족의 특수성이 도드라지고, 한 편의 이야기라고 하기엔 개연성이 없음우연에 기반한 진행이 스토리의 주요한 부분을 차지함"
0,밋밋하고 잼없어요..산만하게 끝까지 본내가 자랑스럽네요 10점만점에 0점..
0,노잼 대학졸업작품걑은느낌
0,평식이형 평론했음 1~2개였을건데 이상황에 글캐하면 욕먹을거 알고 평론안했네 ㅋㅋ
0,개 쓰렉영화 절대 보지 말아라~돈과 시간이 아깝다..소문난 잔치에 먹을게 없다.난 왜 여우조연상 줬는지도 이해가 불가하다.
1,서로 엉겨붙고서라도 꿋꿋이 자라는 미나리들
1,남들은 공감대가 잘 형성될지 모르겠지만 저한테는 도입부에 트럭과 헤치백카로 이사가는 장면부터 울컥했네요.. 영화 스토리가 너무 저와 제 와이프 이야기를 하는것 같았고.. 아이와 장모님은 없었지만 그외적인 이야기들이 ...
0,잘모르겠다 미국정서에 어울리는 듯
0,미나리 나물 광고 영화였음.그냥 뻔한 스토리를 제작비 들어  왜 만들었는지 이해안감.  스토리도 너무 어설픔.  실습생이 만든 연습용 작품큰 실망함.   연습용 영화는 무료로 해주었으면 좋겠음. 댓글 평점 알바 속지...
0,"엄복동보다 더 재미없는 영화이딴영화가 1위하고있는것도 웃기고 ㅋㅋㅋ마지막결말 열린결말?말 그대로 미나리맛있겠더라 엄복동보다 못한영화였다,."
0,히틀러의 만행에 침묵으로 동조한 독일국민들은 자신들의 과오에 대해 철저하게 반성하고 있다. 영화평론가는 자신의 평론을 통해 평론가의 가치를 인정받아야 한다. 그런데 한국의 자칭 평론가들은 흥행작에 대해 평론이 아닌 ...
0,솔직히 재미없네요 비추~
1,미나리....잡초같이 짓밟혀도 일어나는 한국인의 근성
1,정말 감동적이었습니다.
0,왜 상받았는지 몰겟음. 걍 심심한 영화. 윤여정씨 딸로 나온분 연기가 더 좋았음
0,핵노잼. 갑자기 끝. 왜 상 받는지 모르겠음.
0,"아니 아무리 영알못이라해도... 뭘 얘기하려는지는 알것는데 근데 아니 진짜 이게 이렇게 난리날?? 미국감성과 달라서인가...도무지... 윤여정 연기야 항시 최고지만 여우조연,주연상을? 크게 한게 있나...끝나고..멍..."
0,솔직히 윤여정이 이런 발 연기를 하는데 아카데이 조연상에 언급된다는게 난 정말 이해가 안된다..극중 비중있는 역도 아니고..
0,별한개도 아까움..이게뭐람??? 내가 영화를 그렇게 마니봤어도..아휴 진짜 이걸 2시간을봤네
0,졸려요 그냥 졸려요 흐규흐규흐규
0,내가 뭘 본거지.. 영화관에서 졸은 건 처음이다
0,진짜 이렇게 노잼이여도 되는건가....상은 돌려먹기인가....
0,제발 내 시간 돌려줘..
1,데이빗의 할머니사랑이 감동입니다..
0,절대.보지.마세요. 우~~~
0,괜히받네....감동없고 ....
0,그냥 지루하고 연기도 못해서 집중이 안됨.돈아까워요...
0,일단 평론가들이 높게 주었다는건 안좋다는걸 의미. 그분들은 상영도중 필림끊어져 영상안나오면  감동이라며 10점주는 사이코들이다.
0,참~ 그냥 그렇네요좀 마음을 쫄깃하게했다 놓았다 하는곳이 한곳도 없고 그냥 밋밋 하네요
0,스크린쿼터제떄문에 영화관에서 이영화만해서 어쩔수없이본 ...;잼있는 외국영화 겁나많은데..젠장할..
0,기대이하 지루해 죽을 뻔 했네
0,이 밋밋함과 싱거움은 뭐지...
0,아 너무 지루해서 잘뻔했어요
0,"이 영화는 이민자 스토리 다룬 프리미엄이 매우 존나 크다. 쓰뢔기 수준의 대사분량과 스토리, 소문난 잔치에 상차림도 안된 수준"
0,외국에서 상받았다고 평점이 높아야되는것은 아니다. 아무리 힘들고 모든게 불이타도 미나리처럼 우리는 살아간다? 이건뭐 개연성도 없고 감동도 없고. 영상미는 좋드라~~
0,내돈내고 본 2021 최악... ㅡㅡ
0,솔직히 여우조연상급 연기인지 이해가 안됨.
0,제목 미나리??? 스토리??? 영상미??? 결론??? 명절에 TV에서 특선영화 할때까지 기다리심이 좋을듯... ㅠㅠ
1,30대 중반이 접어들고 보니..그냥 영화라기 보다는 삶을 보여주는 것 같았습니다.영상이랑 음악이 정말 좋았고 배우분들의 자연스런 연기와 꼬마친구들이 보는 내내 즐거움을 주었습니다..영화 끝나고 아빠랑 만약 그때 아빠...
0,참내.. 어이가 없어서...
0,터무니없는 국뽕에 빠져서 허우적거리지 말자
0,"이 영화의 진 교훈 : 앞으로 모든 예술작품은(문학,영화, 음악, 미술 등) 서구인의 시각에서 아직 나오지 않은 테마를 선정해야 히트한다. 서구인에겐 아직 생소했으니 마치 프랑스 예술영화처럼 잔잔한 울림이 있었겠지...."
0,왜 계속 영상이 끊기는 듯한 느낌이 드는지 모르겠다 . 허한 이 느낌 뭐지 ... 밥을 잔뜩 먹었는데 뭘 안 먹은 듯 뱃속이 허한 느낌 .
0,유명 영화제와 실제 관람객 사이의 괴리를 적나라하게 볼 수 있는 영화. 시간이 소중하지 않으신 분들께 추천
1,손자가 할머니를 마음으로 받아들여가는 과정은 당연하고 진부하여도 감동적이었습니다.한국적 또 미국적 가치관 / 종교 또 비종교인의 가치관 / 가족의 유대 또는 개인의 성취 등 여러 가치관이 어지럽게 혼재하는 어려움 그...
1,한 사람의 잔잔한 추억을 공유받은 느낌
1,공감능력을 가진 관객이라면 가슴먹먹함에 엔딩 크레딧 에 쉽게 일어나지 못할거 같아요.한예리의 연기도 훌륭하고특히 윤여정님의 눈빛이 잊혀지지가 않습니다....연출면에서 감정선을 매끄럽게 이어나가고 있다는 느낌이 들지않...
1,새 시대의 미국 영화. 어디에도 속하지 않는 이들은 소속감을 스스로 만들어내야 한다. 이민자들을 위한 영화이기 때문에 우리는 크게 감동하지 못할 수도 있다. 하지만 분명 좋은 영화.
1,큰메세지가있네요~ 우리사는 이야기같습니다..
1,"생각보다 별 건 없다고 느꼈다. 다만 영화 중간중간에 나오는 미국 아저씨의 말들은 위로로 다가왔다. ""괜찮다."" ""모든 것이 잘 될거야"" . 막상 힘들고 앞길이 보이지 않을 때는 옆에서 ..."
0,내가 본 영화 중에 최악은 아니여도 그 언저리에  가깝다. 기대가 커서 만은 아니리라. 그냥 스토리 전개가 뭐가 없다. 그냥 인생 극장 제일 무난한 편을 감흥 없이 본 느낌이다.
0,넥플렉스로 본게 신의한수다 진짜...
0,초중반까진 미국에 정착하는 이민자의 일대기가 매우 재밌고 흥미진진하다. 가족간의 정서 변화도 일품. 하지만 후반부에 개연성 없는 억지전개+억지 감동이 매우 짜증나게한다. 윤여정님의 수상이 캐리한 영화. 남자아이도 귀...
0,기대이상 봤는데  딱히  감동을  못 느꼈네요
0,맏딸 애니가 너무 불쌍해
0,"과대평가된 영화. 연출, 각본, 연기 모두 아쉬운 부분이 많았다."
0,상받은 영화 재밌는거 본적있냐?
0,홍보가   미나리를   살린거지왜  돈주고  봤나  후회스럽네요
0,연기는 연기지만 흐름이 어긋나는듯한 스토리?중간마다 포인트 는있지만 흐지부지 한거같아요
0,영화관에서 안보길 잘했다
